{
  "adapter_version": "pwa-kb-adapter/v0.2",
  "adapter_status": "prototype",
  "source_snapshot_version": "hope-kb-runtime-v0.2-batch1-visual-prompt-rules",
  "source_snapshot_hash": "sha256:sample-runtime-kb-snapshot-v0.2-batch1-visual-prompt-rules",
  "scene_catalog_status": "partial",
  "rule_pack_crosswalk_status": "prototype",
  "pwa_snapshot": {
    "snapshotVersion": "hope-kb-runtime-v0.2-batch1-visual-prompt-rules:pwa-adapter-prototype",
    "sceneTypes": [
      "hot_blood_battle",
      "ensemble_performance",
      "emotional_dialogue",
      "encounter_performance",
      "field_chase",
      "spectacle_showcase",
      "daily_healing",
      "guoman_hot_blood_combat",
      "guoman_ensemble_performance",
      "ink_wuxia_combat",
      "eastern_spectacle",
      "xianxia_action",
      "urban_fantasy",
      "chinese_war_formation",
      "weapon_highlight",
      "council_strategy",
      "siege_defense",
      "slg_sandbox_view",
      "slg_march_encirclement",
      "slg_city_growth",
      "slg_battle_report"
    ],
    "allowedDurations": [
      5,
      10,
      15,
      30,
      45,
      60
    ],
    "writingRulePacks": [
      {
        "id": "wg-continuity-core",
        "name": "Writing continuity core",
        "intent": "Preserve accepted user facts, motivation, causality, timeline, and prop state before scene expression or prompt packaging.",
        "influenceAxes": [
          "source_facts",
          "character_continuity",
          "event_order"
        ],
        "directives": [
          "Keep accepted user facts above KB suggestions.",
          "Require cause and consequence for escalation.",
          "Carry unresolved setup and payoff obligations into later stages."
        ],
        "negativeConstraints": [
          "Do not rewrite accepted facts for stronger style.",
          "Do not expose raw source or raw KB rows."
        ]
      },
      {
        "id": "wg-scene-expression-visible-action",
        "name": "Visible action scene expression",
        "intent": "Convert accepted story material into scene objective, obstacle, visible action, reaction, and turning point.",
        "influenceAxes": [
          "scene_expression",
          "event_order",
          "visual_grounding"
        ],
        "directives": [
          "Expose objective, obstacle, action, reaction, and turning point.",
          "Convert exposition into visible behavior only when original intent is preserved.",
          "Block decorative scenes that have no causal purpose."
        ],
        "negativeConstraints": [
          "Do not replace visible action with abstract mood.",
          "Do not let style overwrite story facts."
        ]
      }
    ],
    "directorRulePacks": [
      {
        "id": "dg-director-scheduling-core",
        "name": "Director scheduling core",
        "intent": "Guide performance focus, blocking, rhythm, visual attention, and scene-to-shot handoff.",
        "influenceAxes": [
          "structure",
          "visual_grounding",
          "continuity"
        ],
        "directives": [
          "Blocking must clarify objective, conflict, relation, or reveal.",
          "Rhythm may adjust emphasis but must not delete cause and effect.",
          "Viewer attention should serve visible story function."
        ],
        "negativeConstraints": [
          "Do not let director hints overwrite accepted story facts.",
          "Do not expose internal evidence in storyboard rows."
        ]
      },
      {
        "id": "dg-shot-intent-taxonomy",
        "name": "Shot intent taxonomy",
        "intent": "Select shot intent from scene purpose and director scheduling.",
        "influenceAxes": [
          "shot_intent",
          "structure",
          "visual_grounding"
        ],
        "directives": [
          "Use establish, reveal, pursue, clash, reaction, transition, payoff, spectacle, or detail_insert as first-pass shot intents.",
          "Every shot intent must correspond to visible row behavior.",
          "Shot intent must not require runtime graph traversal."
        ],
        "negativeConstraints": [
          "Do not use intent labels alone as prompt text.",
          "Do not create rows with no visible function."
        ]
      },
      {
        "id": "dg-duration-density",
        "name": "Duration density",
        "intent": "Bind target duration to shot count, beat density, row duration, and validation checks.",
        "influenceAxes": [
          "duration_density",
          "structure",
          "validation_gate"
        ],
        "directives": [
          "Match the target duration exactly.",
          "Use duration-specific shot count guidance.",
          "Reject zero-duration rows and repeated full-budget rows."
        ],
        "negativeConstraints": [
          "Do not accept duration sum mismatch.",
          "Do not treat zero-duration rows as success."
        ]
      },
      {
        "id": "dg-prompt-text-boundary",
        "name": "Prompt text boundary",
        "intent": "Compile clean generation-facing prompt text from accepted facts and confirmed storyboard rows.",
        "influenceAxes": [
          "prompt_boundary",
          "visual_grounding",
          "export_safety"
        ],
        "directives": [
          "Prompt text must include subject, action, frame, camera, duration, and negative constraints.",
          "Prompt text must align with visual_description.",
          "Prompt text must be compiled after the confirmed row."
        ],
        "negativeConstraints": [
          "Do not expose trace refs, schema IDs, source registers, or internal hashes.",
          "Do not emit empty prompt text."
        ]
      },
      {
        "id": "dg-visual-master-consistency",
        "name": "Visual master consistency",
        "intent": "Carry a compact visual master into storyboard rows while preserving accepted facts.",
        "influenceAxes": [
          "visual_master",
          "character_continuity",
          "visual_grounding"
        ],
        "directives": [
          "Carry subject identity, world, palette, lighting logic, material feel, era, and key props into every storyboard row.",
          "Vary framing and action without resetting the visual world.",
          "Treat visual master as continuity guidance, not as a source of new facts."
        ],
        "negativeConstraints": [
          "Do not overwrite accepted body facts.",
          "Do not expose source images, OCR text, local paths, or source registers."
        ]
      },
      {
        "id": "dg-camera-language-grammar",
        "name": "Camera language grammar",
        "intent": "Bind shot function, scale, angle, movement, composition, and adjacent-shot relation to PWA storyboard fields.",
        "influenceAxes": [
          "camera_language",
          "shot_intent",
          "structure"
        ],
        "directives": [
          "Each row should include shot function, shot scale, camera angle, camera movement, and composition logic when useful.",
          "Prefer precise camera language over broad cinematic quality words.",
          "Avoid repeating the same framing and movement across all rows."
        ],
        "negativeConstraints": [
          "Do not use camera vocabulary as empty decoration.",
          "Do not expose internal rule ids in prompt_text."
        ]
      },
      {
        "id": "dg-material-light-air-physicality",
        "name": "Material light air physicality",
        "intent": "Add visible material feedback, light direction, air medium, and environmental response to make prompt text filmable.",
        "influenceAxes": [
          "physicality",
          "lighting",
          "air_medium",
          "visual_grounding",
          "prompt_boundary"
        ],
        "directives": [
          "Add material weight, resistance, wetness, roughness, wear, reflection, or texture only when tied to current action.",
          "Describe light direction, hardness, contrast, rim light, side backlight, shafts, reflection, and shadow relation when visible.",
          "Use rain, fog, dust, smoke, steam, sparks, mist, or water reflection only when supported by scene logic."
        ],
        "negativeConstraints": [
          "Do not add unsupported props, weather, or world facts.",
          "Do not use texture words without physical relation to action or environment.",
          "Do not flatten lighting into generic bright or dark labels."
        ]
      },
      {
        "id": "dg-expression-physicalization",
        "name": "Expression physicalization",
        "intent": "Translate abstract emotion into visible facial and body performance cues suitable for shot scale and camera distance.",
        "influenceAxes": [
          "performance",
          "character_action",
          "visual_grounding",
          "prompt_boundary"
        ],
        "directives": [
          "Convert emotional labels into visible cues such as jaw tension, cheek muscle, locked gaze, eye widening or narrowing, nasal flare, lip pressure, trembling breath, shoulder contraction, guarded posture, or hand hesitation.",
          "Use close-up facial detail only when shot scale supports it.",
          "Use posture, blocking, silhouette, and motion for wide shots."
        ],
        "negativeConstraints": [
          "Do not prompt only vague emotions such as angry, sad, or moved.",
          "Do not over-specify facial muscles in wide shots.",
          "Do not introduce character facts absent from accepted body."
        ]
      },
      {
        "id": "dg-transition-motion-dynamics",
        "name": "Transition and motion dynamics",
        "intent": "Use transition and motion dynamics as controlled guidance for rhythm, continuity, and shot-to-shot readability.",
        "influenceAxes": [
          "transition",
          "motion_dynamics",
          "structure",
          "prompt_boundary",